{
  "id": "fight_conduit", "type": "boss_fight", "creature": "boss_conduit", "name": "Conduit, the Live Wire", "act": 2, "arena": "crusher",
  "_doc": "ENEMIES_BOSSES.md §2.2. Scrap Shuffle repositions after 60 damage in 3 s; phase 2 wakes the plates and the crane magnet.",
  "standin_stats": {"health": 520, "poise": 160, "walk_speed": 3.2},
  "phase2_at": 0.5,
  "dazed": {"duration": 3.0, "damage_taken": 1.2, "throw_mult": 2.0},
  "target_rotate": 8.0,
  "intro_line": "From the power cabinet of the Crusher, seven metres of polite electricity... CONDUIT!",
  "defeat_line": "It unplugs itself and curls up in the power cabinet, blinking politely.",
  "phases": [
    {"id": "loose_wire", "name": "Loose Wire",
     "hazards": [{"kind": "scrap_piles", "count": 3}],
     "reposition": {"after_damage": 60, "attack": "scrap_shuffle"},
     "attack_gap": [2.0, 3.5],
     "attacks": [
       {"id": "whip_tail", "name": "Whip Tail", "weight": 3, "range": [0, 2.8], "cooldown": 4.0, "telegraph": 0.6, "recovery": 0.7, "aim": "target",
        "decal": {"shape": "cone", "radius": 2.2, "cone_deg": 180, "at": "self", "element": "static"},
        "actions": [{"t": 0.0, "type": "area", "shape": "cone", "radius": 2.2, "cone_deg": 180, "damage": 12, "knockback": 2.0, "poise": 25, "stun": 0.3, "element": "static", "buildup": 25}]},
       {"id": "jaw_clamp", "name": "Jaw Clamp", "weight": 2, "range": [0, 2.6], "cooldown": 7.0, "telegraph": 0.7, "recovery": 0.8, "aim": "target", "max_reach": 1.6,
        "decal": {"shape": "line", "length": 1.8, "width": 1.0, "at": "self", "element": "static"},
        "actions": [{"t": 0.0, "type": "rush", "speed_mult": 2.5, "duration": 0.2},
                    {"t": 0.15, "type": "area", "shape": "cone", "radius": 1.8, "cone_deg": 50, "damage": 15, "knockback": 0.5, "poise": 30, "stun": 0.5, "element": "static", "buildup": 50},
                    {"t": 0.2, "type": "grab_throw", "range": 1.9, "hold": 0.5, "segment": "head", "name": "Clamp"},
                    {"t": 0.8, "type": "area", "radius": 1.5, "damage": 8, "knockback": 2.5, "poise": 15, "stun": 0.3, "element": "static", "buildup": 30}]},
       {"id": "arc_spit", "name": "Arc Spit", "weight": 2, "range": [3.0, 12.0], "cooldown": 6.0, "telegraph": 0.8, "recovery": 0.6, "aim": "target",
        "decal": {"shape": "cone", "radius": 6.0, "cone_deg": 30, "at": "self", "element": "static"},
        "actions": [{"t": 0.0, "type": "projectile", "count": 2, "spread_deg": 30, "speed": 6, "life": 1.6, "radius": 0.3, "homing_deg": 120, "aim": "target",
                     "damage": 7, "knockback": 0.5, "poise": 10, "stun": 0.2, "element": "static", "buildup": 40}]},
       {"id": "coil_slam", "name": "Coil Slam", "weight": 2, "range": [0, 4.0], "cooldown": 8.0, "telegraph": 0.9, "recovery": 1.1, "aim": "target", "max_reach": 2.0,
        "decal": {"shape": "circle", "radius": 2.0, "element": "static"},
        "actions": [{"t": 0.0, "type": "area", "at": "aim", "radius": 2.0, "damage": 18, "knockback": 2.5, "poise": 45, "stun": 0.5, "element": "static", "buildup": 45}]},
       {"id": "scrap_shuffle", "name": "Scrap Shuffle", "only_forced": true, "weight": 1, "range": [0, 99], "cooldown": 4.0, "telegraph": 0.5, "recovery": 0.3, "aim": "away", "max_reach": 5.0,
        "decal": {"shape": "circle", "radius": 1.0, "element": "grit"},
        "actions": [{"t": 0.0, "type": "blink", "distance": 5.0, "delay": 0.4, "invuln": 0.3,
                     "on_emerge": [{"type": "zone", "kind": "grit_rubble", "radius": 1.5, "duration": 4.0}]}]}
     ]},
    {"id": "plugged_in", "name": "Plugged In", "speed_mult": 1.15,
     "transition": {"invuln": 2.0, "line": "It bites the crusher's main cable! The plates are live and the magnet is awake!"},
     "hazards": [{"kind": "plates", "every": 3.0}, {"kind": "magnet", "every": 12}],
     "reposition": {"after_damage": 60, "attack": "scrap_shuffle"},
     "attack_gap": [1.8, 3.0],
     "attacks": [
       {"id": "whip_tail", "name": "Whip Tail", "weight": 2, "range": [0, 2.8], "cooldown": 4.0, "telegraph": 0.6, "recovery": 0.7, "aim": "target",
        "decal": {"shape": "cone", "radius": 2.2, "cone_deg": 180, "at": "self", "element": "static"},
        "actions": [{"t": 0.0, "type": "area", "shape": "cone", "radius": 2.2, "cone_deg": 180, "damage": 12, "knockback": 2.0, "poise": 25, "stun": 0.3, "element": "static", "buildup": 25}]},
       {"id": "ground_loop", "name": "Ground Loop", "weight": 2, "range": [0, 8.0], "cooldown": 9.0, "telegraph": 0.8, "recovery": 1.0, "aim": "target",
        "decal": {"shape": "line", "length": 8.0, "width": 1.5, "at": "self", "element": "static"},
        "actions": [{"t": 0.0, "type": "area", "shape": "line", "length": 8.0, "width": 1.5, "yaw_offset": 45, "damage": 10, "knockback": 1.5, "poise": 20, "element": "static", "buildup": 35},
                    {"t": 0.0, "type": "area", "shape": "line", "length": 8.0, "width": 1.5, "yaw_offset": -45, "damage": 10, "knockback": 1.5, "poise": 20, "element": "static", "buildup": 35}]},
       {"id": "overvolt_spit", "name": "Overvolt Spit", "weight": 2, "range": [3.0, 12.0], "cooldown": 7.0, "telegraph": 1.0, "recovery": 0.6, "aim": "target",
        "decal": {"shape": "cone", "radius": 6.0, "cone_deg": 60, "at": "self", "element": "static"},
        "actions": [{"t": 0.0, "type": "projectile", "count": 4, "spread_deg": 60, "speed": 6, "life": 1.8, "radius": 0.3, "homing_deg": 120, "aim": "target",
                     "damage": 7, "knockback": 0.5, "poise": 10, "stun": 0.2, "element": "static", "buildup": 40}]},
       {"id": "coil_slam", "name": "Coil Slam", "weight": 2, "range": [0, 4.0], "cooldown": 7.0, "telegraph": 0.9, "recovery": 1.1, "aim": "target", "max_reach": 2.0,
        "decal": {"shape": "circle", "radius": 2.0, "element": "static"},
        "actions": [{"t": 0.0, "type": "area", "at": "aim", "radius": 2.0, "damage": 18, "knockback": 2.5, "poise": 45, "stun": 0.5, "element": "static", "buildup": 45}]},
       {"id": "discharge", "name": "Discharge", "weight": 1.5, "range": [0, 4.0], "cooldown": 12.0, "telegraph": 1.0, "recovery": 1.4, "aim": "self",
        "decal": {"shape": "circle", "radius": 3.5, "at": "self", "element": "static"},
        "actions": [{"t": 0.0, "type": "area", "radius": 3.5, "damage": 20, "knockback": 3.0, "poise": 50, "stun": 0.6, "element": "static", "buildup": 60}]},
       {"id": "scrap_shuffle", "name": "Scrap Shuffle", "only_forced": true, "weight": 1, "range": [0, 99], "cooldown": 4.0, "telegraph": 0.5, "recovery": 0.3, "aim": "away", "max_reach": 5.0,
        "decal": {"shape": "circle", "radius": 1.0, "element": "grit"},
        "actions": [{"t": 0.0, "type": "blink", "distance": 5.0, "delay": 0.4, "invuln": 0.3,
                     "on_emerge": [{"type": "zone", "kind": "grit_rubble", "radius": 1.5, "duration": 4.0}]}]}
     ]}
  ]
}
