{
  "id": "fight_bilge", "type": "boss_fight", "creature": "boss_bilge", "name": "Bilge, the Cannery Hound", "act": 1, "arena": "drydock",
  "_doc": "ENEMIES_BOSSES.md §2.1. Phases, telegraphed patterns (effects vocabulary) and arena interplay; the body/moveset/art is the boss_bilge creature. standin_stats are only used when a test stands in for the creature.",
  "standin_stats": {"health": 420, "poise": 200, "walk_speed": 3.4},
  "phase2_at": 0.5,
  "dazed": {"duration": 3.0, "damage_taken": 1.2, "throw_mult": 2.0},
  "target_rotate": 8.0,
  "intro_line": "On a seven-metre chain, weighing in at three hundred and twenty kilos of sludge and love... BILGE!",
  "defeat_line": "He sits down, panting. A very good boy with a very bad record.",
  "phases": [
    {"id": "chained", "name": "Chained",
     "leash": {"anchor": [0.8, 0.0], "radius": 7.0, "stumble": 0.8},
     "hazards": [{"kind": "gutter_flood", "every": 20}],
     "attack_gap": [2.0, 3.5],
     "attacks": [
       {"id": "chomp", "name": "Chomp", "weight": 3, "range": [0, 2.6], "cooldown": 3.0, "telegraph": 0.5, "recovery": 0.9, "aim": "target", "max_reach": 2.0,
        "decal": {"shape": "cone", "radius": 2.0, "cone_deg": 60, "at": "self", "element": "sludge"},
        "actions": [{"t": 0.0, "type": "rush", "speed_mult": 2.0, "duration": 0.2},
                    {"t": 0.15, "type": "area", "shape": "cone", "radius": 2.0, "cone_deg": 60, "damage": 14, "knockback": 1.5, "poise": 30, "stun": 0.4, "element": "sludge", "buildup": 30}]},
       {"id": "shake_off", "name": "Shake-Off", "weight": 2, "range": [0, 2.8], "cooldown": 6.0, "telegraph": 0.6, "recovery": 0.6, "aim": "self",
        "decal": {"shape": "circle", "radius": 2.0, "at": "self", "element": "sludge"},
        "actions": [{"t": 0.0, "type": "area", "radius": 2.0, "damage": 10, "knockback": 2.5, "poise": 20, "stun": 0.3, "element": "sludge", "buildup": 20}]},
       {"id": "bilge_spit", "name": "Bilge Spit", "weight": 2, "range": [2.5, 14], "cooldown": 7.0, "telegraph": 0.7, "recovery": 0.5, "aim": "target",
        "decal": {"shape": "cone", "radius": 8.0, "cone_deg": 40, "at": "self", "element": "sludge"},
        "actions": [{"t": 0.0, "type": "projectile", "lob": true, "count": 3, "spread_deg": 40, "speed": 9, "range": 8, "radius": 0.3, "life": 2.0,
                     "damage": 8, "knockback": 1.0, "poise": 10, "stun": 0.2, "element": "sludge", "buildup": 35,
                     "on_expire": {"type": "zone", "kind": "sludge_puddle", "radius": 1.2, "duration": 5}}]},
       {"id": "lunge_chomp", "name": "Lunge-Chomp", "weight": 1.5, "range": [2.0, 7.5], "cooldown": 10.0, "telegraph": 0.8, "recovery": 1.0, "aim": "target", "max_reach": 5.0,
        "decal": {"shape": "line", "length": 5.0, "width": 1.6, "at": "self", "element": "sludge"},
        "actions": [{"t": 0.0, "type": "rush", "speed_mult": 3.2, "duration": 0.45},
                    {"t": 0.45, "type": "area", "shape": "cone", "radius": 1.8, "cone_deg": 70, "damage": 18, "knockback": 3.0, "poise": 40, "stun": 0.5, "element": "sludge", "buildup": 40},
                    {"t": 0.5, "type": "grab_throw", "range": 2.0, "hold": 0.6, "segment": "head", "name": "Shake"}]}
     ]},
    {"id": "off_the_chain", "name": "Off the Chain", "speed_mult": 1.12,
     "transition": {"invuln": 2.0, "line": "He rips the bollard out of the concrete and pulls the drain plug! The whole floor floods!"},
     "remove_hazards": ["gutter_flood"],
     "hazards": [{"kind": "floor_flood"}, {"kind": "chain_sweep", "every": 4}, {"kind": "mooring_blocks", "count": 3}],
     "attack_gap": [1.8, 3.0],
     "attacks": [
       {"id": "chomp", "name": "Chomp", "weight": 2, "range": [0, 2.6], "cooldown": 3.0, "telegraph": 0.5, "recovery": 0.9, "aim": "target", "max_reach": 2.0,
        "decal": {"shape": "cone", "radius": 2.0, "cone_deg": 60, "at": "self", "element": "sludge"},
        "actions": [{"t": 0.0, "type": "rush", "speed_mult": 2.0, "duration": 0.2},
                    {"t": 0.15, "type": "area", "shape": "cone", "radius": 2.0, "cone_deg": 60, "damage": 14, "knockback": 1.5, "poise": 30, "stun": 0.4, "element": "sludge", "buildup": 30}]},
       {"id": "belly_flop", "name": "Belly Flop", "weight": 2, "range": [1.5, 7.0], "cooldown": 8.0, "telegraph": 1.0, "recovery": 1.2, "aim": "target", "max_reach": 4.0,
        "decal": {"shape": "circle", "radius": 2.5, "element": "brine"},
        "actions": [{"t": 0.0, "type": "leap", "distance": 4.0, "height": 1.2, "time": 0.6},
                    {"t": 0.6, "type": "area", "at": "aim", "radius": 2.5, "damage": 16, "knockback": 3.0, "poise": 40, "stun": 0.5, "element": "brine", "buildup": 40},
                    {"t": 0.62, "type": "area", "at": "aim", "shape": "ring", "radius": 4.0, "inner": 2.5, "damage": 6, "knockback": 1.5, "poise": 15, "element": "brine", "buildup": 20}]},
       {"id": "rabid_rush", "name": "Rabid Rush", "weight": 1.5, "range": [2.0, 10.0], "cooldown": 11.0, "telegraph": 0.8, "recovery": 1.0, "aim": "target",
        "decal": {"shape": "line", "length": 4.0, "width": 1.6, "at": "self", "element": "sludge"},
        "actions": [{"t": 0.0, "type": "rush", "speed_mult": 3.0, "duration": 0.4},
                    {"t": 0.35, "type": "area", "shape": "cone", "radius": 1.6, "cone_deg": 80, "damage": 12, "knockback": 3.0, "poise": 30, "element": "sludge", "buildup": 25},
                    {"t": 0.6, "type": "aim", "length": 4.0, "width": 1.6, "telegraph": 0.5},
                    {"t": 1.1, "type": "rush", "speed_mult": 3.0, "duration": 0.4},
                    {"t": 1.45, "type": "area", "shape": "cone", "radius": 1.6, "cone_deg": 80, "damage": 12, "knockback": 3.0, "poise": 30, "element": "sludge", "buildup": 25},
                    {"t": 1.7, "type": "aim", "length": 4.0, "width": 1.6, "telegraph": 0.5},
                    {"t": 2.2, "type": "rush", "speed_mult": 3.0, "duration": 0.4},
                    {"t": 2.55, "type": "area", "shape": "cone", "radius": 1.6, "cone_deg": 80, "damage": 12, "knockback": 3.0, "poise": 30, "element": "sludge", "buildup": 25}]},
       {"id": "bilge_spit", "name": "Bilge Spit", "weight": 2, "range": [2.5, 14], "cooldown": 6.0, "telegraph": 0.7, "recovery": 0.5, "aim": "target",
        "decal": {"shape": "cone", "radius": 8.0, "cone_deg": 60, "at": "self", "element": "sludge"},
        "actions": [{"t": 0.0, "type": "projectile", "lob": true, "count": 5, "spread_deg": 60, "speed": 9, "range": 8, "radius": 0.3, "life": 2.0,
                     "damage": 8, "knockback": 1.0, "poise": 10, "stun": 0.2, "element": "sludge", "buildup": 35,
                     "on_expire": {"type": "zone", "kind": "sludge_puddle", "radius": 1.2, "duration": 5}}]}
     ]}
  ]
}
